{
  "schemaVersion": "0.2",
  "id": "biblical-people",
  "label": {
    "fr": "Personnages bibliques",
    "en": "Biblical people"
  },
  "rootType": "person",
  "facets": [
    {
      "relation": "role",
      "widget": "entity-picker"
    },
    {
      "relation": "attributed_authorship",
      "widget": "entity-picker"
    },
    {
      "relation": "traditional_authorship",
      "widget": "entity-picker"
    }
  ],
  "pivots": [
    "historical_authorship",
    "traditional_authorship",
    "attributed_authorship",
    "disputed_authorship",
    "pseudepigraphic_authorship"
  ],
  "constellation": {
    "defaultSatelliteCount": 12,
    "groups": [
      {
        "id": "family",
        "label": {
          "fr": "Famille et parenté",
          "en": "Family and kinship"
        },
        "priority": 1.0,
        "source": {
          "kind": "relations",
          "ids": [
            "bibrel.father",
            "bibrel.mother",
            "bibrel.son",
            "bibrel.daughter",
            "bibrel.brother",
            "bibrel.sister",
            "bibrel.half-brother",
            "bibrel.half-sister",
            "bibrel.husband",
            "bibrel.wife",
            "bibrel.ancestor",
            "bibrel.descendant"
          ]
        }
      },
      {
        "id": "discipleship",
        "label": {
          "fr": "Disciples, maîtres et compagnons",
          "en": "Disciples, masters and companions"
        },
        "priority": 0.92,
        "source": {
          "kind": "relations",
          "ids": [
            "bibrel.disciple",
            "bibrel.apostle",
            "bibrel.rabbi",
            "bibrel.master",
            "bibrel.servant",
            "bibrel.ally"
          ]
        }
      },
      {
        "id": "roles",
        "label": {
          "fr": "Rôles",
          "en": "Roles"
        },
        "priority": 0.86,
        "source": {
          "kind": "relations",
          "ids": [
            "role"
          ]
        }
      },
      {
        "id": "works",
        "label": {
          "fr": "Œuvres attribuées",
          "en": "Attributed works"
        },
        "priority": 0.8,
        "source": {
          "kind": "relations",
          "ids": [
            "historical_authorship",
            "traditional_authorship",
            "attributed_authorship",
            "disputed_authorship",
            "pseudepigraphic_authorship"
          ]
        }
      },
      {
        "id": "other-relations",
        "label": {
          "fr": "Autres relations",
          "en": "Other relationships"
        },
        "priority": 0.68,
        "source": {
          "kind": "relations",
          "ids": [
            "bibrel.king",
            "bibrel.killed-by",
            "bibrel.killer",
            "bibrel.exiled",
            "bibrel.exiled-by",
            "bibrel.patron",
            "bibrel.client"
          ]
        }
      }
    ]
  }
}
