{
  "schemaVersion": "0.2",
  "id": "theophile-questions",
  "label": {
    "fr": "Questions philosophiques",
    "en": "Philosophical questions"
  },
  "rootType": "editorial",
  "facets": [
    {
      "relation": "corpus:mobilise_theme",
      "widget": "entity-picker"
    },
    {
      "relation": "corpus:met_en_dialogue_auteur",
      "widget": "entity-picker"
    }
  ],
  "pivots": [
    "corpus:appuie_sur_position",
    "corpus:mobilise_theme",
    "corpus:met_en_dialogue_auteur"
  ],
  "constellation": {
    "defaultSatelliteCount": 12,
    "groups": [
      {
        "id": "authors",
        "label": {
          "fr": "Auteurs en dialogue",
          "en": "Authors in dialogue"
        },
        "priority": 1.0,
        "source": {
          "kind": "relations",
          "ids": [
            "corpus:met_en_dialogue_auteur"
          ]
        }
      },
      {
        "id": "themes",
        "label": {
          "fr": "Idées et thèmes",
          "en": "Ideas and themes"
        },
        "priority": 0.98,
        "source": {
          "kind": "relations",
          "ids": [
            "corpus:mobilise_theme"
          ]
        }
      },
      {
        "id": "positions",
        "label": {
          "fr": "Positions sources",
          "en": "Source positions"
        },
        "priority": 0.95,
        "source": {
          "kind": "relations",
          "ids": [
            "corpus:appuie_sur_position"
          ]
        }
      },
      {
        "id": "argument",
        "label": {
          "fr": "Reconstruction argumentative",
          "en": "Argument reconstruction"
        },
        "priority": 0.82,
        "source": {
          "kind": "relations",
          "ids": [
            "corpus:reconstruction_argumentative"
          ]
        }
      }
    ]
  }
}
