{
  "schemaVersion": "0.2",
  "id": "intellectual-history",
  "label": {
    "fr": "Histoire intellectuelle",
    "en": "intellectual history"
  },
  "rootType": "human",
  "facets": [
    {
      "relation": "lifespan",
      "widget": "year-range"
    },
    {
      "relation": "field_of_work",
      "widget": "entity-picker"
    },
    {
      "relation": "movement",
      "widget": "entity-picker"
    }
  ],
  "pivots": [
    "authored_work"
  ],
  "constellation": {
    "defaultSatelliteCount": 8,
    "groups": [
      {
        "id": "expertise",
        "label": {
          "fr": "Expertises",
          "en": "Expertise"
        },
        "priority": 1.0,
        "source": {
          "kind": "relations",
          "ids": [
            "field_of_work"
          ]
        }
      },
      {
        "id": "works",
        "label": {
          "fr": "Œuvres",
          "en": "Works"
        },
        "priority": 0.95,
        "source": {
          "kind": "relations",
          "ids": [
            "authored_work"
          ]
        }
      },
      {
        "id": "thought",
        "label": {
          "fr": "Courants et pensée",
          "en": "Movements and thought"
        },
        "priority": 0.86,
        "source": {
          "kind": "relations",
          "ids": [
            "movement"
          ]
        }
      },
      {
        "id": "context",
        "label": {
          "fr": "Origines et contexte",
          "en": "Origins and context"
        },
        "priority": 0.8,
        "source": {
          "kind": "relations",
          "ids": [
            "birth_place",
            "citizenship"
          ]
        }
      },
      {
        "id": "tradition",
        "label": {
          "fr": "Traditions",
          "en": "Traditions"
        },
        "priority": 0.72,
        "source": {
          "kind": "relations",
          "ids": [
            "religious_tradition"
          ]
        }
      }
    ]
  }
}
